{"cases":[{"assertion_evaluations":[{"assertion_id":"g07-asm-001","effective_from":"2025-03-05","effective_legal_effect_at_as_of":"ENTITLED_TO_PROVIDE","effective_to":null,"evidence":[{"authority":"European Securities and Markets Authority (ESMA)","extractor_version":"FINREG_G05A_EXTRACTION_V3","observed_current":true,"raw_snapshot_sha256":"0af299b12a3086e336cf6eaded8db9fee0db6a501b84b8d04467305b38a51a9a","raw_value":"{\"fields\":{\"authorisation_end_date\":\"\",\"authorisation_notification_date\":\"05/03/2025\",\"commercial_name\":\"BBVA\",\"competent_authority\":\"Comision Nacional del Mercado de Valores (CNMV)\",\"home_member_state\":\"ES\",\"last_update\":\"07/03/2026\",\"legal_name\":\"Banco Bilbao Vizcaya Argentaria S.A.\",\"lei\":\"K8MS7FD7N5Z2WQ51AZ71\",\"lei_diagnostic\":\"K8MS7FD7N5Z2WQ51AZ71\",\"lei_valid\":\"K8MS7FD7N5Z2WQ51AZ71\",\"service_codes_raw\":\"a. providing custody and administration of crypto-assets on behalf of clients.|e. execution of orders for crypto-assets on behalf of clients.|j. providing transfer services for crypto-assets on behalf of clients.\",\"service_countries_raw\":\"ES\"},\"record_key\":{\"field\":\"ae_lei\",\"value\":\"K8MS7FD7N5Z2WQ51AZ71\"}}","register_id":"ESMA_MICA_REGISTER","retrieved_at":"2026-09-13","source_as_of":null,"source_date_reliability":"UNAVAILABLE","source_url":"https://www.esma.europa.eu/sites/default/files/2024-12/CASPS.csv"}],"legal_basis":"MiCA (UE) 2023/1114 art. 63: la seccion CASPS del registro interino ESMA documenta ac_authorisationNotificationDate como fecha de autorizacion del CASP conforme al art. 63 (h7-esma-fields.csv)","reason":"IN_EFFECT","register_id":"ESMA_MICA_REGISTER","source_legal_effect":"ENTITLED_TO_PROVIDE"}],"assessment":"CONFIRMED_AUTHORISED","case_id":"G07-001","derived_assertion_ids":[],"diagnostics":[],"expected_assessment":"CONFIRMED_AUTHORISED","expected_reason":"SUPPORTED_BY_ACTIVE_ASSERTIONS","identity_resolution":"EXACT","match":true,"matching_assertion_ids":["g07-asm-001"],"query":{"activity":"CRYPTO_ASSET_SERVICES","as_of":"2026-09-13","entity_id":"G05-001","jurisdiction":"ES"},"reason":"SUPPORTED_BY_ACTIVE_ASSERTIONS","reason_match":true,"source_claim_ids":["G05-001|ESMA_MICA_REGISTER|authorisation_end_date","G05-001|ESMA_MICA_REGISTER|authorisation_notification_date","G05-001|ESMA_MICA_REGISTER|commercial_name","G05-001|ESMA_MICA_REGISTER|competent_authority","G05-001|ESMA_MICA_REGISTER|home_member_state","G05-001|ESMA_MICA_REGISTER|last_update","G05-001|ESMA_MICA_REGISTER|legal_name","G05-001|ESMA_MICA_REGISTER|lei","G05-001|ESMA_MICA_REGISTER|lei_diagnostic","G05-001|ESMA_MICA_REGISTER|lei_valid","G05-001|ESMA_MICA_REGISTER|service_codes_raw","G05-001|ESMA_MICA_REGISTER|service_countries_raw"],"used_assertion_ids":["g07-asm-001"]},{"assertion_evaluations":[{"assertion_id":"g07-asm-097","effective_from":"2026-06-26","effective_legal_effect_at_as_of":"ENTITLED_TO_PROVIDE","effective_to":null,"evidence":[{"authority":"European Securities and Markets Authority (ESMA)","extractor_version":"FINREG_G05A_EXTRACTION_V3","observed_current":true,"raw_snapshot_sha256":"0af299b12a3086e336cf6eaded8db9fee0db6a501b84b8d04467305b38a51a9a","raw_value":"{\"fields\":{\"authorisation_end_date\":\"\",\"authorisation_notification_date\":\"26/06/2026\",\"commercial_name\":\"CRIPTAN\",\"competent_authority\":\"Comision Nacional del Mercado de Valores (CNMV)\",\"home_member_state\":\"ES\",\"last_update\":\"09/07/2026\",\"legal_name\":\"CRIPTAN TRADE S.L.\",\"lei\":\"959800AZN23P7F30C189\",\"lei_diagnostic\":\"959800AZN23P7F30C189\",\"lei_valid\":\"959800AZN23P7F30C189\",\"service_codes_raw\":\"a. providing custody and administration of crypto-assets on behalf of clients.|c. exchange of crypto-assets for funds|d. exchange of crypto-assets for other crypto-assets|j. providing transfer services for crypto-assets on behalf of clients.\",\"service_countries_raw\":\"ES|AT|BE|BG|CY|CZ|DE|DK|EE|GR|FI|FR|HR|HU|IE|IT|LT|LU|LV|MT|NL|PL|PT|RO|SE|SI|SK\"},\"record_key\":{\"field\":\"ae_lei\",\"value\":\"959800AZN23P7F30C189\"}}","register_id":"ESMA_MICA_REGISTER","retrieved_at":"2026-09-13","source_as_of":null,"source_date_reliability":"UNAVAILABLE","source_url":"https://www.esma.europa.eu/sites/default/files/2024-12/CASPS.csv"}],"legal_basis":"MiCA (UE) 2023/1114 art. 63: la seccion CASPS del registro interino ESMA documenta ac_authorisationNotificationDate como fecha de autorizacion del CASP conforme al art. 63 (h7-esma-fields.csv)","reason":"IN_EFFECT","register_id":"ESMA_MICA_REGISTER","source_legal_effect":"ENTITLED_TO_PROVIDE"}],"assessment":"CONFIRMED_AUTHORISED","case_id":"G07-002","derived_assertion_ids":[],"diagnostics":[],"expected_assessment":"CONFIRMED_AUTHORISED","expected_reason":"SUPPORTED_BY_ACTIVE_ASSERTIONS","identity_resolution":"EXACT","match":true,"matching_assertion_ids":["g07-asm-097"],"query":{"activity":"CRYPTO_ASSET_SERVICES","as_of":"2026-09-13","entity_id":"G05-010","jurisdiction":"ES"},"reason":"SUPPORTED_BY_ACTIVE_ASSERTIONS","reason_match":true,"source_claim_ids":["G05-010|ESMA_MICA_REGISTER|authorisation_end_date","G05-010|ESMA_MICA_REGISTER|authorisation_notification_date","G05-010|ESMA_MICA_REGISTER|commercial_name","G05-010|ESMA_MICA_REGISTER|competent_authority","G05-010|ESMA_MICA_REGISTER|home_member_state","G05-010|ESMA_MICA_REGISTER|last_update","G05-010|ESMA_MICA_REGISTER|legal_name","G05-010|ESMA_MICA_REGISTER|lei","G05-010|ESMA_MICA_REGISTER|lei_diagnostic","G05-010|ESMA_MICA_REGISTER|lei_valid","G05-010|ESMA_MICA_REGISTER|service_codes_raw","G05-010|ESMA_MICA_REGISTER|service_countries_raw"],"used_assertion_ids":["g07-asm-097"]},{"assertion_evaluations":[{"assertion_id":"g07-asm-131","effective_from":"2026-07-31","effective_legal_effect_at_as_of":"ENTITLED_TO_PROVIDE","effective_to":null,"evidence":[{"authority":"European Securities and Markets Authority (ESMA)","extractor_version":"FINREG_G05A_EXTRACTION_V3","observed_current":true,"raw_snapshot_sha256":"0af299b12a3086e336cf6eaded8db9fee0db6a501b84b8d04467305b38a51a9a","raw_value":"{\"fields\":{\"authorisation_end_date\":\"\",\"authorisation_notification_date\":\"31/07/2026\",\"commercial_name\":\"FAZIL CRYPTO\",\"competent_authority\":\"Comision Nacional del Mercado de Valores (CNMV)\",\"home_member_state\":\"ES\",\"last_update\":\"17/08/2026\",\"legal_name\":\"BASQUE PAY S.L.\",\"lei\":\"9598005WW6HZ4V82BZ26\",\"lei_diagnostic\":\"9598005WW6HZ4V82BZ26\",\"lei_valid\":\"9598005WW6HZ4V82BZ26\",\"service_codes_raw\":\"g. reception and transmission of orders for crypto-assets on behalf of clients\",\"service_countries_raw\":\"ES\"},\"record_key\":{\"field\":\"ae_lei\",\"value\":\"9598005WW6HZ4V82BZ26\"}}","register_id":"ESMA_MICA_REGISTER","retrieved_at":"2026-09-13","source_as_of":null,"source_date_reliability":"UNAVAILABLE","source_url":"https://www.esma.europa.eu/sites/default/files/2024-12/CASPS.csv"}],"legal_basis":"MiCA (UE) 2023/1114 art. 63: la seccion CASPS del registro interino ESMA documenta ac_authorisationNotificationDate como fecha de autorizacion del CASP conforme al art. 63 (h7-esma-fields.csv)","reason":"IN_EFFECT","register_id":"ESMA_MICA_REGISTER","source_legal_effect":"ENTITLED_TO_PROVIDE"}],"assessment":"CONFIRMED_AUTHORISED","case_id":"G07-003","derived_assertion_ids":[],"diagnostics":[],"expected_assessment":"CONFIRMED_AUTHORISED","expected_reason":"SUPPORTED_BY_ACTIVE_ASSERTIONS","identity_resolution":"EXACT","match":true,"matching_assertion_ids":["g07-asm-131"],"query":{"activity":"CRYPTO_ASSET_SERVICES","as_of":"2026-09-13","entity_id":"G05-014","jurisdiction":"ES"},"reason":"SUPPORTED_BY_ACTIVE_ASSERTIONS","reason_match":true,"source_claim_ids":["G05-014|ESMA_MICA_REGISTER|authorisation_end_date","G05-014|ESMA_MICA_REGISTER|authorisation_notification_date","G05-014|ESMA_MICA_REGISTER|commercial_name","G05-014|ESMA_MICA_REGISTER|competent_authority","G05-014|ESMA_MICA_REGISTER|home_member_state","G05-014|ESMA_MICA_REGISTER|last_update","G05-014|ESMA_MICA_REGISTER|legal_name","G05-014|ESMA_MICA_REGISTER|lei","G05-014|ESMA_MICA_REGISTER|lei_diagnostic","G05-014|ESMA_MICA_REGISTER|lei_valid","G05-014|ESMA_MICA_REGISTER|service_codes_raw","G05-014|ESMA_MICA_REGISTER|service_countries_raw"],"used_assertion_ids":["g07-asm-131"]},{"assertion_evaluations":[{"assertion_id":"g07-asm-005","effective_from":"2025-10-31","effective_legal_effect_at_as_of":"ENTITLED_TO_PROVIDE","effective_to":null,"evidence":[{"authority":"European Securities and Markets Authority (ESMA)","extractor_version":"FINREG_G05A_EXTRACTION_V3","observed_current":true,"raw_snapshot_sha256":"0af299b12a3086e336cf6eaded8db9fee0db6a501b84b8d04467305b38a51a9a","raw_value":"{\"fields\":{\"authorisation_end_date\":\"\",\"authorisation_notification_date\":\"31/10/2025\",\"commercial_name\":\"Bit2Me\",\"competent_authority\":\"Comision Nacional del Mercado de Valores (CNMV)\",\"home_member_state\":\"ES\",\"last_update\":\"03/11/2025\",\"legal_name\":\"Bitcoinforme S.L.\",\"lei\":\"9598007R5LSUJLGLS853\",\"lei_diagnostic\":\"9598007R5LSUJLGLS853\",\"lei_valid\":\"9598007R5LSUJLGLS853\",\"service_codes_raw\":\"a. providing custody and administration of crypto-assets on behalf of clients.|c. exchange of crypto-assets for funds|d. exchange of crypto-assets for other crypto-assets|e. execution of orders for crypto-assets on behalf of clients.|f. placing of crypto-assets|g. reception and transmission of orders for crypto-assets on behalf of clients.|j. providing transfer services for crypto-assets on behalf of clients.\",\"service_countries_raw\":\"ES|AT|BE|BG|CY|CZ|DE|DK|EE|GR|FI|FR|HR|HU|IE|IS|IT|LI|LT|LU|LV|MT|NL|NO|PL|PT|RO|SE|SI|SK\"},\"record_key\":{\"field\":\"ae_lei\",\"value\":\"9598007R5LSUJLGLS853\"}}","register_id":"ESMA_MICA_REGISTER","retrieved_at":"2026-09-13","source_as_of":null,"source_date_reliability":"UNAVAILABLE","source_url":"https://www.esma.europa.eu/sites/default/files/2024-12/CASPS.csv"}],"legal_basis":"MiCA (UE) 2023/1114 art. 63: la seccion CASPS del registro in